<?xml version="1.0" encoding="UTF-8"?>
<!DOCTYPE questionnaire SYSTEM "tadeq11.dtd">
<questionnaire id="">
    <qobject number="1" name="Q9_FILTER">
        <split>
            <condition><![CDATA[QB = Male and (QA = Scotland or QA = Wales) and (Q5 = Less or Q5 = 1-3)]]></condition>
            <if_true>
                <qobject number="2" name="Q9">...</qobject>
            </if_true>
            <if_false>
                <qobject number="3" name="Q10">...</qobject>
            </if_false>
            <involved><![CDATA[QA]]></involved>
            <involved><![CDATA[QB]]></involved>
            <involved><![CDATA[Q5]]></involved>
        </split>
    </qobject>
</questionnaire>